{
  "approval_type": "personal-relay-gate1-finding-dispositions",
  "approved_at": "2026-08-05T02:03:44Z",
  "approved_by": {
    "login": "justinharkelroad",
    "id": 130851957,
    "node_id": "U_kgDOB8ykdQ"
  },
  "deployment_ref": "ghcr.io/justinharkelroad/buzz-relay-personal@sha256:e8a6d86125134af5ccb2f7bd82bf00b24c50416800a1fa212751d44a1b639b17",
  "dispositions": [
    {
      "architecture": "amd64",
      "class": "os-pkgs",
      "decision": "accepted-risk",
      "evidence_reference": "https://github.com/justinharkelroad/buzz/actions/runs/30966189040",
      "expires_at": "2026-11-03T02:03:44Z",
      "finding_id": "07f878b4b68e91138a922e4bde3a2d614ef830452908cda00b4a40ea73a7eae3",
      "finding_index": 194,
      "fixed_version": "",
      "installed_version": "5.36.0-7+deb12u3",
      "package_id": "libperl5.36@5.36.0-7+deb12u3",
      "package_name": "libperl5.36",
      "rationale": "No fixed version available in Debian 12 stable at scan time. Base-image package, not Buzz source. Relay runtime is a single Rust binary with limited exposure of this package. Accepted 90 days pending rescan at the next release.",
      "report_kind": "container_image",
      "result_index": 0,
      "reviewed_at": "2026-08-05T02:03:44Z",
      "reviewed_by": {
        "login": "justinharkelroad",
        "id": 130851957,
        "node_id": "U_kgDOB8ykdQ"
      },
      "severity": "CRITICAL",
      "target": "ghcr.io/justinharkelroad/buzz-relay-personal@sha256:f63c73af0c4bb9d0ef77b8caa0e5327564b427067005c1ec012047a928b268f5 (debian 12.15)",
      "type": "debian",
      "vulnerability_id": "CVE-2026-57433"
    },
    {
      "architecture": "amd64",
      "class": "os-pkgs",
      "decision": "accepted-risk",
      "evidence_reference": "https://github.com/justinharkelroad/buzz/actions/runs/30966189040",
      "expires_at": "2026-11-03T02:03:44Z",
      "finding_id": "085c8810d4a65bad3740f83bd904310fff571189f0f3737cc7559ed28889cc69",
      "finding_index": 288,
      "fixed_version": "",
      "installed_version": "5.36.0-7+deb12u3",
      "package_id": "perl-base@5.36.0-7+deb12u3",
      "package_name": "perl-base",
      "rationale": "No fixed version available in Debian 12 stable at scan time. Base-image package, not Buzz source. Relay runtime is a single Rust binary with limited exposure of this package. Accepted 90 days pending rescan at the next release.",
      "report_kind": "container_image",
      "result_index": 0,
      "reviewed_at": "2026-08-05T02:03:44Z",
      "reviewed_by": {
        "login": "justinharkelroad",
        "id": 130851957,
        "node_id": "U_kgDOB8ykdQ"
      },
      "severity": "HIGH",
      "target": "ghcr.io/justinharkelroad/buzz-relay-personal@sha256:f63c73af0c4bb9d0ef77b8caa0e5327564b427067005c1ec012047a928b268f5 (debian 12.15)",
      "type": "debian",
      "vulnerability_id": "CVE-2026-42497"
    },
    {
      "architecture": "amd64",
      "class": "os-pkgs",
      "decision": "accepted-risk",
      "evidence_reference": "https://github.com/justinharkelroad/buzz/actions/runs/30966189040",
      "expires_at": "2026-11-03T02:03:44Z",
      "finding_id": "0be2e77b284261ff3244b6075cdce3f5d1b40b808c8f53e0a9e398b0397cd3dc",
      "finding_index": 286,
      "fixed_version": "",
      "installed_version": "5.36.0-7+deb12u3",
      "package_id": "perl-base@5.36.0-7+deb12u3",
      "package_name": "perl-base",
      "rationale": "No fixed version available in Debian 12 stable at scan time. Base-image package, not Buzz source. Relay runtime is a single Rust binary with limited exposure of this package. Accepted 90 days pending rescan at the next release.",
      "report_kind": "container_image",
      "result_index": 0,
      "reviewed_at": "2026-08-05T02:03:44Z",
      "reviewed_by": {
        "login": "justinharkelroad",
        "id": 130851957,
        "node_id": "U_kgDOB8ykdQ"
      },
      "severity": "CRITICAL",
      "target": "ghcr.io/justinharkelroad/buzz-relay-personal@sha256:f63c73af0c4bb9d0ef77b8caa0e5327564b427067005c1ec012047a928b268f5 (debian 12.15)",
      "type": "debian",
      "vulnerability_id": "CVE-2026-57433"
    },
    {
      "architecture": "amd64",
      "class": "os-pkgs",
      "decision": "accepted-risk",
      "evidence_reference": "https://github.com/justinharkelroad/buzz/actions/runs/30966189040",
      "expires_at": "2026-11-03T02:03:44Z",
      "finding_id": "0e3c7407f960faa9e9b0cb65b442977b9788e75b52c849ffff5240e53988e844",
      "finding_index": 305,
      "fixed_version": "",
      "installed_version": "5.36.0-7+deb12u3",
      "package_id": "perl-modules-5.36@5.36.0-7+deb12u3",
      "package_name": "perl-modules-5.36",
      "rationale": "No fixed version available in Debian 12 stable at scan time. Base-image package, not Buzz source. Relay runtime is a single Rust binary with limited exposure of this package. Accepted 90 days pending rescan at the next release.",
      "report_kind": "container_image",
      "result_index": 0,
      "reviewed_at": "2026-08-05T02:03:44Z",
      "reviewed_by": {
        "login": "justinharkelroad",
        "id": 130851957,
        "node_id": "U_kgDOB8ykdQ"
      },
      "severity": "HIGH",
      "target": "ghcr.io/justinharkelroad/buzz-relay-personal@sha256:f63c73af0c4bb9d0ef77b8caa0e5327564b427067005c1ec012047a928b268f5 (debian 12.15)",
      "type": "debian",
      "vulnerability_id": "CVE-2026-48962"
    },
    {
      "architecture": "arm64",
      "class": "os-pkgs",
      "decision": "accepted-risk",
      "evidence_reference": "https://github.com/justinharkelroad/buzz/actions/runs/30966189040",
      "expires_at": "2026-11-03T02:03:44Z",
      "finding_id": "0fccfca45aff4d27931df900cfa8c15b85de60bd5eaee249e2b3ff3b69d7645e",
      "finding_index": 270,
      "fixed_version": "",
      "installed_version": "5.36.0-7+deb12u3",
      "package_id": "perl@5.36.0-7+deb12u3",
      "package_name": "perl",
      "rationale": "No fixed version available in Debian 12 stable at scan time. Base-image package, not Buzz source. Relay runtime is a single Rust binary with limited exposure of this package. Accepted 90 days pending rescan at the next release.",
      "report_kind": "container_image",
      "result_index": 0,
      "reviewed_at": "2026-08-05T02:03:44Z",
      "reviewed_by": {
        "login": "justinharkelroad",
        "id": 130851957,
        "node_id": "U_kgDOB8ykdQ"
      },
      "severity": "CRITICAL",
      "target": "ghcr.io/justinharkelroad/buzz-relay-personal@sha256:1d1ced7c33344359f94c7d2b39db293ae24fe66930b33b097f7284b63e15e25f (debian 12.15)",
      "type": "debian",
      "vulnerability_id": "CVE-2026-57433"
    },
    {
      "architecture": "amd64",
      "class": "os-pkgs",
      "decision": "accepted-risk",
      "evidence_reference": "https://github.com/justinharkelroad/buzz/actions/runs/30966189040",
      "expires_at": "2026-11-03T02:03:44Z",
      "finding_id": "13485e762fcc3ad6183588d280e36efba4888d3e8974d64cad625b558e36faa5",
      "finding_index": 192,
      "fixed_version": "",
      "installed_version": "5.36.0-7+deb12u3",
      "package_id": "libperl5.36@5.36.0-7+deb12u3",
      "package_name": "libperl5.36",
      "rationale": "No fixed version available in Debian 12 stable at scan time. Base-image package, not Buzz source. Relay runtime is a single Rust binary with limited exposure of this package. Accepted 90 days pending rescan at the next release.",
      "report_kind": "container_image",
      "result_index": 0,
      "reviewed_at": "2026-08-05T02:03:44Z",
      "reviewed_by": {
        "login": "justinharkelroad",
        "id": 130851957,
        "node_id": "U_kgDOB8ykdQ"
      },
      "severity": "CRITICAL",
      "target": "ghcr.io/justinharkelroad/buzz-relay-personal@sha256:f63c73af0c4bb9d0ef77b8caa0e5327564b427067005c1ec012047a928b268f5 (debian 12.15)",
      "type": "debian",
      "vulnerability_id": "CVE-2026-13221"
    },
    {
      "architecture": "arm64",
      "class": "os-pkgs",
      "decision": "accepted-risk",
      "evidence_reference": "https://github.com/justinharkelroad/buzz/actions/runs/30966189040",
      "expires_at": "2026-11-03T02:03:44Z",
      "finding_id": "13540c0490d68c0cbe929daf3abd9092a7c4e246c010f648cfc852ea6809f875",
      "finding_index": 86,
      "fixed_version": "",
      "installed_version": "7.88.1-10+deb12u15",
      "package_id": "libcurl3-gnutls@7.88.1-10+deb12u15",
      "package_name": "libcurl3-gnutls",
      "rationale": "No fixed version available in Debian 12 stable at scan time. Base-image package, not Buzz source. Relay runtime is a single Rust binary with limited exposure of this package. Accepted 90 days pending rescan at the next release.",
      "report_kind": "container_image",
      "result_index": 0,
      "reviewed_at": "2026-08-05T02:03:44Z",
      "reviewed_by": {
        "login": "justinharkelroad",
        "id": 130851957,
        "node_id": "U_kgDOB8ykdQ"
      },
      "severity": "HIGH",
      "target": "ghcr.io/justinharkelroad/buzz-relay-personal@sha256:1d1ced7c33344359f94c7d2b39db293ae24fe66930b33b097f7284b63e15e25f (debian 12.15)",
      "type": "debian",
      "vulnerability_id": "CVE-2026-8927"
    },
    {
      "architecture": "arm64",
      "class": "os-pkgs",
      "decision": "accepted-risk",
      "evidence_reference": "https://github.com/justinharkelroad/buzz/actions/runs/30966189040",
      "expires_at": "2026-11-03T02:03:44Z",
      "finding_id": "145a93d814f07af8b9566baba35506f6fc135533405f1148d0236662bb73696f",
      "finding_index": 269,
      "fixed_version": "",
      "installed_version": "5.36.0-7+deb12u3",
      "package_id": "perl@5.36.0-7+deb12u3",
      "package_name": "perl",
      "rationale": "No fixed version available in Debian 12 stable at scan time. Base-image package, not Buzz source. Relay runtime is a single Rust binary with limited exposure of this package. Accepted 90 days pending rescan at the next release.",
      "report_kind": "container_image",